,Title,Date,id,
163608,Business News: Biogen MS Drug Fails Study Goals; Shares Drop 13%,2016/6/8,1,
501601,The Benefactors: Brushes With Death Turn the Very Wealthy Into Medical Medicis --- But Bankrolling Research Isn't Enough; They Also Want a Voice in the Lab --- Huntsman's Cancer Fight,1998/1/6,1,
468485,Rite Aid to Settle Lawsuit and Lift Ban on Brokers,2000/6/19,1,
556838,Health Care Brief -- HCA Inc.: Hospital Chain's Net Fell 31% In Second Quarter on Charges; Dow Jones Newswires,2003/7/23,1,
561006,UPS Plans Small Rate Increases; Price Raises for Deliveries Are Slimmer Than Usual As Competition Heightens,2003/11/21,1,
320171,Amazon Turnover Holds Up Union --- Steady pace of worker departures means lots of new hires will vote at Alabama warehouse,2021/12/30,1,
581758,Technology Brief -- Sprint Corp.: Bankruptcy Filing Is Made By Horizon PCS Inc. Affiliate,2003/8/18,1,
918622,Corporate News: GE Makes Big Bet on Software Development,2011/11/17,1,
616673,Leading the News: U.S. Carriers Seek to Revamp Operations --- Bankruptcy Filing by UAL Is Expected Today; Financing Package Set to Keep Planes Flying,2002/12/9,1,
731739,Google Philanthropy Director To Take On Disease Outbreaks; Dr. Brilliant Starts Project Promoting Early Detection Of Global Health Crises,2006/2/27,1,
524561,"New President of Coca-Cola Ventures, Heyer, Plans to Expand Product Offerings",2001/3/8,1,
472831,"McAfee, Microsoft Enter Partnership Of Software Sales",2001/5/23,1,
897184,"At Cisco, Results Show Progress",2011/8/11,1,
547264,Cendant Says Profit to Be Hurt By Mortgage Area,2002/9/26,1,
601000,"Spilling Over: Top Banks Come Under Scrutiny For Role in Parmalat Scandal; Italian Dairy Giant Claims Bank of America, Others Aided Financial Cover-Up; An Entity Called 'Black Hole'",2004/9/28,1,Y
291744,EXCHANGE --- Heard on the Street: It May Be Years Until the Chips Are Down at Apple,2020/12/12,1,
835334,Exxon to Pay $6.1 Million Fine Over Spill,2008/12/24,1,
688664,General Mills Inc.,2006/6/15,1,
213436,Amazon to Unlock Doors for Deliveries,2017/10/26,1,
421052,PCs: Gateway to Use Its Stores to Lure Small Businesses,1999/4/8,1,
618236,Xerox Deals With Citibank Are Examined by the SEC,2001/5/22,1,
714198,Textron Inc.,2006/4/21,1,
863361,Digital Media: Myspace Deepens Ties to Facebook,2010/11/19,1,
106264,Ruth Porat Clicks on Google,2015/3/25,1,
9726,Global Finance: AIG Buying Hartford Financial Brokerage Unit,2012/8/1,1,
631208,"Comcast's Profit Jumps 64% On Revenue, Margin Increases",2005/8/3,1,
141601,A Quick Fix for the U.S. 'Icebreaker Gap',2016/2/4,1,
557585,Energy Brief -- ConocoPhillips: Natural-Gas Project Is Set To Go Ahead in Timor Sea,2003/6/16,1,
437204,"GM Chief Smith's 1998 Bonus Was Cut More Than Half, Firm's Proxy Shows",1999/4/21,1,
725452,Ford Motor Co.: Edison Unit to Launch Hybrid-Vehicle Test,2007/7/10,1,
859905,Corporate News: Apple's TV Model Uses Cheaper Chip,2010/9/3,1,
339184,Ford Sells 7 Million Shares of EV Maker Rivian,2022/5/16,1,
547740,States Rejoin Federal Effort In Case Against Microsoft,1998/4/30,1,
764705,Coca-Cola Co.: Board Authorizes Buyback Of Up to 300 Million Shares,2006/7/21,1,
389342,Letters to the Editor: Fastest Solution To the Wage Gap,1999/2/19,1,
451608,Letters to the Editor: Disabled Travelers Suffer Humiliations,2001/5/24,1,
618830,Engineering Brief -- Danaher Corp.: Offer for First Technology Trumps Bid From Honeywell,2006/1/21,1,
497157,Pepsi Is Set to Become The Cola of Choice For United Airlines --- UAL Ends Decades-Long Pact With Coke and Signs Five-Year Deal With Rival,2002/3/25,1,
509949,Business Brief -- Marriott International Inc.: Venture Set With Cendant To License Ramada Brand,2002/3/4,1,
98464,Greenberg Gets Turn To Make AIG Case,2014/9/29,1,
879132,"Microcontrollers Include New Technology --- Texas Instruments Offers Alternative to Flash Memory That Writes Data Faster, Uses Less Power Than Old Ones",2011/5/4,1,
667669,Chevron Corp.,2006/3/8,1,
809373,"The Morning Brief: Lehman and AIG, Markets and the Fed",2008/9/16,1,
221392,EXCHANGE --- On Business: Apple Needs A Next Act,2019/1/12,1,
725893,Corporate News: Caterpillar to Take Control Of Joint Venture in Japan,2008/3/27,1,
656733,Verizon Sees Progress Toward Labor Pact,2003/8/6,1,
480504,Starr Backs Breakup Of Microsoft at Forum,2001/2/22,1,
417786,Business Brief -- AMR Corp.: Jet Order for $2.1 Billion Is Received by Boeing Co.,1998/8/17,1,
175210,Yahoo Detected Russia Hack in '14,2016/9/24,1,
466919,J. Peterman Is Saved By $10 Million Offer Of Paul Harris Stores,1999/3/8,1,
871967,Corporate News: Apollo and Entrepreneur Consider Sara Lee Buyout,2011/1/10,1,
779310,U.S. News: Chevron Is Cleared Over Nigeria Killings,2008/12/2,1,
466536,General Motors Plans Moves Designed To Increase European Market Share,1999/9/16,1,
794329,GM Bulks Up Finance Roster; Auto Maker Names Brazil Chief Young Group Vice President,2007/10/4,1,
349215,Apple Turns to the Pros --- Latest iPhone Pro models see strong demand -- good news for the tech giant,2022/9/28,1,
460874,Eaton Faces $55 Million Verdict in Liability Suit,2001/2/7,1,
399216,"Norwest, Wells Fargo Tap Operating Officer For Merged Firm",1998/10/1,1,
685453,Calpine Corp.: Firm Enters Exclusive Talks To Sell Plants for $357 Million,2005/6/15,1,
757037,"Kraft Foods Inc.: Product Prices Rise to Offset Higher Energy, Packaging Costs",2005/11/9,1,
711101,"Bank of America to Eliminate 7,500 Jobs",2008/6/27,1,
841885,Corporate News: CVS Fires Back in Walgreen Spat,2010/6/16,1,
33037,AMR Can't Scrap Contract For Pilots,2012/8/16,1,
722046,"Boeing and BellSouth Gain; AT&amp;T, NetEase, Gilead Drop",2003/10/30,1,
718062,New Sprint Director to Call for Changes; Activist Whitworth May Lobby To Put Carrier on the Block,2008/2/13,1,
418026,"Pepsi's Profit Falls 10%, but Sales Rise As U.S. Beverage Line Shows Strength",1999/2/2,1,
344245,Dollar Erases P&amp;G's Sales Gains --- Maker of Tide detergent and Gillette razors predicts first annual decline in years,2022/10/20,1,
724846,GM Pulls Car Ad After Complaints; Groups and Consumers Say Boy Speeding in 'Dream' Plugs Reckless Behavior,2004/8/26,1,
648305,"ZTE Corp.: Chinese Company, Cisco Agree To Collaborate on Sales in Asia",2005/11/25,1,
548744,Wal-Mart Projects Sales Increase,2002/7/2,1,
620584,Retail Brief -- Levi Strauss &amp; Co.: Net Income Fell 29% as Sales Rose 2% for Fiscal 4th Quarter,2003/1/14,1,
477221,Business Brief -- VWR SCIENTIFIC PRODUCTS CORP.: Merger Agreement Is Made With Unit of Merck KGaA,1999/6/9,1,
648650,Western Union Lines Up Board,2006/8/30,1,
210719,Tencent Has to Learn From Facebook,2017/11/22,1,
549156,Leading the News: Hershey Trust Calls Off Sale of Firm --- Board Was Set to Meet To Accept $12.5 Billion Bid From Wm. Wrigley Jr. Co.,2002/9/18,1,
514443,"UPS to Raise Rates at Least 2.9%, Citing Increased Labor Costs",2002/11/11,1,
399421,Microsoft to Split Into Four Major Groups,1999/3/12,1,
823308,Chinese Learn English the Disney Way,2009/4/20,1,
790340,Google Strives to Help Online Software Catch Up --- Internet Giant Entices Developers to Embrace New Browser Technologies as It Takes on Traditional Programs,2009/7/14,1,
444981,Fortune Brands Selects Wesley To Be President,1998/9/30,1,
809501,"Shares of 3Com Jump 34%, Extreme Networks Follows",2007/9/29,1,
510326,Business Brief -- SBC COMMUNICATIONS INC.: Pacific Bell Unit to Offer High-Speed Internet Access,1998/5/28,1,
693233,HealthSouth Ex-Employee Says Owens Hid Fraud From Scrushy,2005/5/5,1,Y
797792,Pfizer Cedes Control of Diabetes Drug,2007/11/14,1,
535319,Judge's Decision Against Microsoft Corp. May Threaten the Windows Trademark,2002/3/19,1,
406542,Some Curators Find Treasures in Palaces; Others Head for eBay,1999/9/29,1,
167617,Business News: Tribune CEO Criticizes Gannett,2016/4/27,1,
164708,"Business News: Wal-Mart to Cut Nearly 1,000 Corporate Jobs This Month",2017/1/11,1,
417136,EMC,1999/10/19,1,
635405,Virgin America Taps AMR Veteran; Carty Becomes Chairman As Start-Up Airline Fields Questions About Ownership,2006/2/7,1,
656708,Halliburton Iraq Report Is an Inconclusive Draft,2004/3/10,1,
261161,The SBC Has a Sex-Abuse Problem,2019/12/27,1,Y
451075,Georgia-Pacific Profit Declines by 43%; Sluggish Building-Products Sector Cited,2000/10/19,1,
485207,"Dana Corp. Matches Forecasts, but Warns About Next Quater",1999/10/19,1,
816290,Goldman Names Prime-Broker Chief,2009/11/3,1,
81345,$1 Billion Blunder Trips Up Walgreen,2014/8/20,1,
317255,"Business News: 'Eternals' Leads at Box Office --- Disney's Marvel epic is fourth-highest debut since pandemic began, boosting theaters",2021/11/8,1,
364052,"At Railroads, 'Hurry Up and Get It Done' --- Norfolk Southern sets guideline to inspect a railcar's wheels and brakes in one minute",2023/3/31,1,
631424,Earnings at 3M Increase Slightly; Forecast Is Raised,2005/7/19,1,
650937,"Mr. Mudd Bets On Makeover For Fannie Mae; Amid Scrutiny From Regulators, Chief Envisions a Mortgage Firm Free of Controversy, Full of Energy",2006/1/12,1,
576127,Leading the News: Deutsche Post Is Ready to Buy Part of Airborne,2003/3/24,1,
495054,"EarthLink, Sprint Revise Their Alliance",2001/2/12,1,
863017,Facebook's New Front in Rivalry --- Messaging Service Is Designed to Sharpen Battle With Google for Internet Users,2010/11/16,1,
856589,"Corporate News: Verizon Reports Loss, Plans to Cut More Jobs --- Charge for Layoffs Erases Profit; Wireless Growth Fails to Blunt Impact of Slow Fixed-Line-Phone Spending by Businesses",2010/1/27,1,
889299,Liberty Media Bids for Barnes,2011/5/20,1,
713400,Earnings Digest -- Leisure: Las Vegas Sands Corp.,2008/2/5,1,
511727,Computer Sciences Posts 13% Rise in Net Amid Lull in Software-Consulting Business,2000/8/1,1,
680545,"Pixar, Disney Keep Investors on Seat's Edge; As Distribution Talks Continue, Analysts, Shareholders Wonder If a Bigger Deal Is in the Works",2005/12/15,1,
577382,Automotive Brief: Ford Motor Co.,2004/11/18,1,
681055,"Pension Plans Are Adjusted After Enron --- Workers, Firms Shy Away From Owning Too Much of 1 Thing",2002/1/29,1,
910832,BofA Helps DJIA Score Another Win,2012/1/11,1,
815735,Earnings Digest -- Engineering: KBR Inc.,2008/5/3,1,
765758,"Microsoft Helps Drive Broad Rally; Countrywide Rises 14% As Merrill Sheds 0.3% After Loss, CEO Actions",2007/10/27,1,
733485,FedEx Corp.: Trucking Line to Be Acquired; Dividend Is Increased by 13%,2006/5/30,1,
434696,Cisco Agrees to Buy SightPath,2000/3/30,1,
506349,Why J.P. Morgan Keeps Showing Up in the Wrong Place,2002/3/14,1,
913924,Santorum's Southern Comfort,2012/3/14,1,
594677,"Business Brief -- Broadcom Corp.: Net Loss Narrowed, as Charge Hurt Year-Earlier Third Period",2002/10/18,1,
121021,"Inquiry Turns to Top China Officials --- U.S. seeks information on anticorruption chief, others linked to J.P. Morgan Chase hiring",2015/5/28,1,Y
376523,Google AI Looms as Big Threat To News Publishers,2023/12/15,1,
390586,UPS to Guarantee On-Time Ground Delivery,1998/4/10,1,
246331,"EXCHANGE --- Why China Moved First on Boeing --- On track to become the world's biggest aviation superpower, the country is flexing its muscle as an arbiter of safety",2019/3/16,1,
110956,Business News: Labor Group Takes On McDonald's,2015/3/17,1,
464057,News Corp.'s Chase Carey to Be Named To Head Planned Platco Satellite Venture,2000/6/12,1,
433902,"Micron Technology Earnings Increase, But Fall Short of Estimates for Quarter",2000/3/22,1,
32196,GM Bids to Reacquire Part of Lending Business It Shed,2012/8/14,1,
608950,Business Brief -- Ryder System Inc.: Net Income of $19.8 Million Reverses the Year-Earlier Loss,2003/4/24,1,
653637,"Kinder Morgan Gets Proposal To Take It Private; Management-Led Buyout, Valued at $13.5 Billion, Would Be Biggest of Its Kind",2006/5/30,1,
514427,Interstate Bakeries Net Income Rises 94% Due to Cost Cutting,2001/7/9,1,
162404,Business News: Gap to Close Stores Amid Sales Slump,2016/5/20,1,
455918,Ball CEO Sees Growth Prospects in Can Industry,2001/1/22,1,
760109,El Paso Corp.: Proved Gas Reserves in 2004 Declined by Roughly 12%,2005/2/23,1,
452571,Discrimination Suit Against Texaco Wins Status as Class Action,2000/3/10,1,Y
633008,Chase to Install ATMs In Duane Reade Stores,2005/6/22,1,
311035,"Google, Univision Set Cloud Contract",2021/4/27,1,
494910,Dell Shifts Strategy to Make Servers Its No. 1 Priority,2000/4/6,1,
409784,Memo From Boeing CEO Says No Executive Changes,1998/12/15,1,
612060,Interpublic Hires Blamer as CEO Of Foote Cone,2004/12/16,1,
346238,"Verizon, Google Developing iPad Rival",2010/5/12,1,